<?xml version="1.0"?>
<!--
To change this license header, choose License Headers in Project Properties.
To change this template file, choose Tools | Templates
and open the template in the editor.
-->

<xs:schema version="1.0"
           xmlns:xs="http://www.w3.org/2001/XMLSchema"
           elementFormDefault="qualified">
    <xs:simpleType name="maxmin">
        <xs:restriction base="xs:integer">
            <xs:minInclusive value="-100"/>
            <xs:maxInclusive value="100"/>
        </xs:restriction>
    </xs:simpleType>
    <xs:element name="prediccion">
        <xs:complexType>
            <xs:sequence>
                <xs:element name="municipio">
                    <xs:complexType>
                        <xs:sequence>
                            <xs:element name="nombre" type="xs:string"/>
                            <xs:element name="provincia" type="xs:string"/>
                        </xs:sequence>
                        <xs:attribute name="id" type="xs:ID" use="required"/>
                    </xs:complexType>
                </xs:element>
                <xs:element name="dia" maxOccurs="unbounded">
                    <xs:complexType>
                        <xs:sequence>
                            <xs:element name="prob_precipitacion">
                                <xs:simpleType>
                                    <xs:restriction base="xs:integer">
                                        <xs:minInclusive value="0"/>
                                        <xs:maxInclusive value="100"/>
                                    </xs:restriction>
                                </xs:simpleType>
                            </xs:element>
                            <xs:element name="estado_cielo">
                                <xs:complexType>
                                    <xs:simpleContent>
                                        <xs:extension base="xs:integer">
                                            <xs:attribute name="descripcion">
                                                <xs:simpleType>
                                                    <xs:restriction base="xs:string">
                                                        <xs:maxLength value="255"/>
                                                    </xs:restriction>
                                                </xs:simpleType>
                                            </xs:attribute>
                                        </xs:extension>
                                    </xs:simpleContent>
                                </xs:complexType>
                            </xs:element>
                            <xs:element name="viento">
                                <xs:complexType>
                                    <xs:sequence>
                                        <xs:element name="direccion">
                                            <xs:simpleType>
                                                <xs:restriction base="xs:string">
                                                    <xs:enumeration value="Norte"/>
                                                    <xs:enumeration value="Sur"/>
                                                    <xs:enumeration value="Este"/>
                                                    <xs:enumeration value="Oeste"/>
                                                    <xs:enumeration value="Noreste"/>
                                                    <xs:enumeration value="Noroestee"/>
                                                    <xs:enumeration value="Sureste"/>
                                                    <xs:enumeration value="Suroeste"/>
                                                </xs:restriction>
                                            </xs:simpleType>
                                        </xs:element>
                                        <xs:element name="velocidad">
                                            <xs:simpleType>
                                                <xs:restriction base="xs:integer">
                                                    <xs:minInclusive value="0"/>
                                                    <xs:maxInclusive value="400"/>
                                                </xs:restriction>
                                            </xs:simpleType>
                                        </xs:element>
                                    </xs:sequence>
                                </xs:complexType>
                            </xs:element>
                            <xs:element name="temperatura">
                                <xs:complexType>
                                    <xs:sequence>                         
                                        <xs:element name="minimo" type="maxmin"/>
                                        <xs:element name="maximo" type="maxmin"/>
                                    </xs:sequence>
                                </xs:complexType>
                            </xs:element>
                        </xs:sequence>
                        <xs:attribute name="fecha" type="xs:date"/>
                    </xs:complexType>
                </xs:element>
            </xs:sequence>
        </xs:complexType>
    </xs:element>
</xs:schema>